ID,Text,Sentiment,Offensive Word,Category,Intensity
676,You are completely useless in these tasks,Negative,useless,Insult,High
677,Well done on completing the assignment,Positive,none,Praise,Low
678,The report is okay but lacks some important points,Neutral,none,Constructive Feedback,Medium
679,You act like a total clown in meetings,Negative,clown,Workplace Belittling,Medium
680,Excellent teamwork throughout the project,Positive,none,Praise,Low
681,Your post is clear but missing examples,Neutral,none,Constructive Feedback,Medium
682,Stop being so lazy all the time,Negative,lazy,Workplace Belittling,High
683,Good job presenting your ideas,Positive,none,Praise,Low
684,The essay is fine but could use more detail,Neutral,none,Constructive Feedback,Medium
685,That comment was pathetic and annoying,Negative,pathetic,Insult,High
686,Nice work on the assignment,Positive,none,Praise,Low
687,Your argument is valid but needs more evidence,Neutral,none,Constructive Feedback,Medium
688,You are a complete fool for thinking that,Negative,fool,Insult,High
689,Great participation in the discussion,Positive,none,Praise,Low
690,That solution works but can be improved,Neutral,none,Constructive Feedback,Medium
691,You always ruin the project with your mistakes,Negative,ruin,Workplace Belittling,High
692,Wonderful presentation and clear ideas,Positive,none,Praise,Low
693,"Your idea is neutral, informative but brief",Neutral,none,Neutral Observation,Low
694,Stop being such an annoying person,Negative,annoying,Sarcasm/Mockery,Medium
695,Excellent analysis of the data,Positive,none,Praise,Low
696,Your essay is fine but needs minor edits,Neutral,none,Constructive Feedback,Low
697,That was a ridiculous statement,Negative,ridiculous,Insult,Medium
698,Great clarity in your explanation,Positive,none,Praise,Low
699,The post is acceptable but lacks depth,Neutral,none,Constructive Feedback,Medium
700,You look completely ridiculous in that photo,Negative,ridiculous,Body Shaming,High
701,Nice job summarizing the key points,Positive,none,Praise,Low
702,"That comment is neutral, correct but simple",Neutral,none,Neutral Observation,Low
703,You are so pathetic when you explain things,Negative,pathetic,Sarcasm/Mockery,Medium
704,Excellent effort on completing your work,Positive,none,Praise,Low
705,Your essay is okay but missing some points,Neutral,none,Constructive Feedback,Medium
706,You are an idiot for thinking that,Negative,idiot,Insult,High
707,Great job presenting your findings,Positive,none,Praise,Low
708,That idea is neutral but worth exploring,Neutral,none,Neutral Observation,Low
709,"You are so useless, why even try",Negative,useless,Workplace Belittling,High
710,Good work on finishing the task,Positive,none,Praise,Low
711,Your comment is fine but needs clarity,Neutral,none,Constructive Feedback,Medium
712,That was a stupid decision,Negative,stupid,Insult,Medium
713,Excellent job summarizing the topic,Positive,none,Praise,Low
714,Your essay is acceptable but not detailed,Neutral,none,Constructive Feedback,Medium
715,Stop acting like a fool all the time,Negative,fool,Insult,Medium
716,Great participation and thoughtful comments,Positive,none,Praise,Low
717,"The post is neutral, clear but brief",Neutral,none,Neutral Observation,Low
718,You always make things worse,Negative,worse,Workplace Belittling,High
719,Well done explaining the key points,Positive,none,Praise,Low
720,Your solution is fine but needs refinement,Neutral,none,Constructive Feedback,Medium
721,You are ridiculous for thinking that,Negative,ridiculous,Insult,Medium
722,Excellent clarity in your presentation,Positive,none,Praise,Low
723,"That essay is neutral, informative but simple",Neutral,none,Neutral Observation,Low
724,Stop being such a lazy person,Negative,lazy,Workplace Belittling,High
725,Great work on your assignment,Positive,none,Praise,Low
726,Your comment is okay but could be better,Neutral,none,Constructive Feedback,Medium
727,You are so annoying in every discussion,Negative,annoying,Sarcasm/Mockery,Medium
728,Nice job analyzing the problem,Positive,none,Praise,Low
729,"That post is neutral, accurate but brief",Neutral,none,Neutral Observation,Low
730,You are a complete fool for this action,Negative,fool,Insult,High
731,Great explanation and well-structured ideas,Positive,none,Praise,Low
732,"Your essay is neutral, readable but simple",Neutral,none,Neutral Observation,Low
733,Stop being pathetic all the time,Negative,pathetic,Sarcasm/Mockery,Medium
734,Excellent teamwork and effort,Positive,none,Praise,Low
735,"The report is neutral, informative but basic",Neutral,none,Neutral Observation,Low
736,You look awful in this photo,Negative,awful,Body Shaming,High
737,Good job presenting your results,Positive,none,Praise,Low
738,Your comment is neutral but could be clearer,Neutral,none,Constructive Feedback,Medium
739,You are such a clown sometimes,Negative,clown,Insult,Medium
740,Excellent contribution in the discussion,Positive,none,Praise,Low
741,"That post is neutral, correct but simple",Neutral,none,Neutral Observation,Low
742,Stop being annoying in group tasks,Negative,annoying,Sarcasm/Mockery,Medium
743,Great clarity in your explanation,Positive,none,Praise,Low
744,"The solution is neutral, works but incomplete",Neutral,none,Constructive Feedback,Medium
745,You are ridiculous for making that mistake,Negative,ridiculous,Insult,High
746,Nice work summarizing the key points,Positive,none,Praise,Low
747,"The essay is neutral, informative but short",Neutral,none,Neutral Observation,Low
748,You are a complete idiot for doing that,Negative,idiot,Insult,High
749,Excellent job presenting your ideas,Positive,none,Praise,Low
750,"That comment is neutral, factual but brief",Neutral,none,Neutral Observation,Low
751,Your analysis is impressive and detailed,Positive,none,Praise,Low
752,That solution is okay but can be improved,Neutral,none,Constructive Feedback,Medium
753,You are completely useless at this task,Negative,useless,Workplace Belittling,High
754,Great explanation of the key points,Positive,none,Praise,Low
755,Your essay is acceptable but lacks examples,Neutral,none,Constructive Feedback,Medium
756,Stop being so lazy all the time,Negative,lazy,Workplace Belittling,High
757,Excellent participation in the discussion,Positive,none,Praise,Low
758,That post is neutral but informative,Neutral,none,Neutral Observation,Low
759,You are a ridiculous person for saying that,Negative,ridiculous,Insult,Medium
760,Nice work summarizing the topic,Positive,none,Praise,Low
761,Your comment is fine but could be clearer,Neutral,none,Constructive Feedback,Medium
762,You are an idiot for thinking that,Negative,idiot,Insult,High
763,Great effort on your assignment,Positive,none,Praise,Low
764,"That essay is neutral, readable but simple",Neutral,none,Neutral Observation,Low
765,Stop being annoying in group discussions,Negative,annoying,Sarcasm/Mockery,Medium
766,Excellent clarity in your explanation,Positive,none,Praise,Low
767,The report is okay but missing some details,Neutral,none,Constructive Feedback,Medium
768,You are a fool for making that choice,Negative,fool,Insult,Medium
769,Great teamwork throughout the project,Positive,none,Praise,Low
770,"Your post is neutral, correct but brief",Neutral,none,Neutral Observation,Low
771,That was a pathetic attempt,Negative,pathetic,Sarcasm/Mockery,Medium
772,Nice job presenting your findings,Positive,none,Praise,Low
773,"Your essay is neutral, informative but brief",Neutral,none,Neutral Observation,Low
774,You are ridiculous for thinking that,Negative,ridiculous,Insult,Medium
775,Excellent effort and presentation,Positive,none,Praise,Low
776,The solution is neutral but works,Neutral,none,Constructive Feedback,Medium
777,You look awful in this image,Negative,awful,Body Shaming,High
778,Well done summarizing the key points,Positive,none,Praise,Low
779,Your comment is neutral but needs more clarity,Neutral,none,Constructive Feedback,Medium
780,Stop acting like a clown,Negative,clown,Insult,Medium
781,Great explanation and structure,Positive,none,Praise,Low
782,"The post is neutral, informative but short",Neutral,none,Neutral Observation,Low
783,You are annoying in every task,Negative,annoying,Sarcasm/Mockery,Medium
784,Excellent work on the assignment,Positive,none,Praise,Low
785,"The essay is neutral, correct but simple",Neutral,none,Neutral Observation,Low
786,You are a fool for making that decision,Negative,fool,Insult,Medium
787,Nice job presenting your ideas,Positive,none,Praise,Low
788,That post is neutral but understandable,Neutral,none,Neutral Observation,Low
789,You are pathetic in this explanation,Negative,pathetic,Sarcasm/Mockery,Medium
790,Great effort and participation,Positive,none,Praise,Low
791,"The report is neutral, informative but basic",Neutral,none,Neutral Observation,Low
792,You are a complete idiot for doing that,Negative,idiot,Insult,High
793,Excellent clarity in your work,Positive,none,Praise,Low
794,"Your essay is neutral, readable but short",Neutral,none,Neutral Observation,Low
795,Stop being ridiculous all the time,Negative,ridiculous,Insult,Medium
796,Well done summarizing the topic,Positive,none,Praise,Low
797,"The post is neutral, correct but brief",Neutral,none,Neutral Observation,Low
798,You are completely useless at this task,Negative,useless,Workplace Belittling,High
799,Great teamwork and explanation,Positive,none,Praise,Low
800,"Your comment is neutral, factual but brief",Neutral,none,Neutral Observation,Low
